date,title,published,publisher,source,matched_pattern,week,relevance_score,matched_keywords,date.1,sentiment_score
2025-01-04 08:00:00,"Croissance, dette… 2024 a été un «an foiré» pour la france, 2025 risque d’être un «an pire» - capital.fr","Sat, 04 Jan 2025 08:00:00 GMT","{'href': 'https://www.capital.fr', 'title': 'Capital.fr'}",capital.fr,capital,2024-12-24,14,"['dette', 'croissance', 'risque']",2025-01-04 08:00:00,-0.9646
2025-01-05 08:00:00,"Entretiens à bercy sur le budget : le ministre de l'économie éric lombard, un ""homme de gauche"" attendu au tournant par les socialistes - franceinfo","Sun, 05 Jan 2025 08:00:00 GMT","{'href': 'https://www.franceinfo.fr', 'title': 'Franceinfo'}",franceinfo.fr,franceinfo,2024-12-24,6,['budget'],2025-01-05 08:00:00,0.6518
2025-01-06 08:00:00,Les économistes plus pessimistes sur la croissance en france - les echos,"Mon, 06 Jan 2025 08:00:00 GMT","{'href': 'https://www.lesechos.fr', 'title': 'Les Echos'}",lesechos.fr,echos,2024-12-24,4,['croissance'],2025-01-06 08:00:00,-0.7781
2025-01-06 08:00:00,"« a l’aube de 2025, rarement l’économie avait cumulé autant de risques et d’incertitude » - le monde.fr","Mon, 06 Jan 2025 08:00:00 GMT","{'href': 'https://www.lemonde.fr', 'title': 'Le Monde.fr'}",lemonde.fr,lemonde,2024-12-24,8,"['incertitude', 'risque']",2025-01-06 08:00:00,-0.7833
2025-01-06 08:00:00,"Dette. « le problème de la france n’est pas son endettement, mais la répartition de ses richesses » - ouest-france","Mon, 06 Jan 2025 08:00:00 GMT","{'href': 'https://www.ouest-france.fr', 'title': 'Ouest-France'}",ouest-france.fr,ouest-france,2024-12-24,9,['dette'],2025-01-06 08:00:00,-0.6516
2025-01-06 08:00:00,Démission de justin trudeau : trois infographies pour comprendre la crise politique au canada - l'express,"Mon, 06 Jan 2025 08:00:00 GMT","{'href': 'https://www.lexpress.fr', 'title': ""L'Express""}",lexpress.fr,express,2024-12-24,4,['crise'],2025-01-06 08:00:00,-0.6639
2025-01-06 08:00:00,Budget 2025 : marine le pen estime que le ministre de l’économie a envoyé un « très mauvais signal » - ouest-france,"Mon, 06 Jan 2025 08:00:00 GMT","{'href': 'https://www.ouest-france.fr', 'title': 'Ouest-France'}",ouest-france.fr,ouest-france,2024-12-24,6,['budget'],2025-01-06 08:00:00,-0.949
2025-01-06 08:00:00,"Budget 2025 : la ministre des comptes publics annonce un plan contre la ""suroptimisation fiscale"" et la fraude - franceinfo","Mon, 06 Jan 2025 08:00:00 GMT","{'href': 'https://www.franceinfo.fr', 'title': 'Franceinfo'}",franceinfo.fr,franceinfo,2024-12-24,6,['budget'],2025-01-06 08:00:00,0.4256
2025-01-06 08:00:00,"La france vise un déficit public entre 5 % et 5,5 % du pib en 2025 - ouest-france","Mon, 06 Jan 2025 08:00:00 GMT","{'href': 'https://www.ouest-france.fr', 'title': 'Ouest-France'}",ouest-france.fr,ouest-france,2024-12-24,14,"['déficit', 'pib']",2025-01-06 08:00:00,0.0
2025-01-06 08:00:00,La banque centrale chinoise s'oriente vers une politique monétaire plus traditionnelle - les echos,"Mon, 06 Jan 2025 08:00:00 GMT","{'href': 'https://www.lesechos.fr', 'title': 'Les Echos'}",lesechos.fr,echos,2024-12-24,16,"['banque centrale', 'politique monétaire']",2025-01-06 08:00:00,0.6601
2025-01-06 08:00:00,"Croissance, inflation, chômage... a quoi faut-il s'attendre pour l'économie française en 2025 ? - franceinfo","Mon, 06 Jan 2025 08:00:00 GMT","{'href': 'https://www.franceinfo.fr', 'title': 'Franceinfo'}",franceinfo.fr,franceinfo,2024-12-24,18,"['inflation', 'croissance', 'chômage']",2025-01-06 08:00:00,-0.5228
2025-01-07 08:00:00,"Cuba, plongé dans une crise économique et sociale, attire de moins en moins de visiteurs - outre-mer la 1ère","Tue, 07 Jan 2025 08:00:00 GMT","{'href': 'https://la1ere.franceinfo.fr', 'title': 'Outre-mer la 1ère'}",la1ere.franceinfo.fr,franceinfo,2024-12-24,4,['crise'],2025-01-07 08:00:00,-0.9394
2025-01-07 08:00:00,Kpmg cède son activité tpe-pme à towerbrook - les echos,"Tue, 07 Jan 2025 08:00:00 GMT","{'href': 'https://capitalfinance.lesechos.fr', 'title': 'Les Echos'}",capitalfinance.lesechos.fr,echos,2024-12-24,8,"['tpe', 'pme']",2025-01-07 08:00:00,0.0
2025-01-08 08:00:00,Taux d’emploi : la france reste à la traîne - le point,"Wed, 08 Jan 2025 08:00:00 GMT","{'href': 'https://www.lepoint.fr', 'title': 'Le Point'}",lepoint.fr,lepoint,2025-01-08,4,['emploi'],2025-01-08 08:00:00,0.0
2025-01-08 08:00:00,"Grèce : le pays se relève de la crise, mais à quel prix ? - franceinfo","Wed, 08 Jan 2025 08:00:00 GMT","{'href': 'https://www.franceinfo.fr', 'title': 'Franceinfo'}",franceinfo.fr,franceinfo,2025-01-08,8,"['prix', 'crise']",2025-01-08 08:00:00,0.0
2025-01-11 08:00:00,Mark zuckerberg revient sur la politique de diversité de meta et appelle à plus « d'énergie masculine - les echos,"Sat, 11 Jan 2025 08:00:00 GMT","{'href': 'https://www.lesechos.fr', 'title': 'Les Echos'}",lesechos.fr,echos,2025-01-08,4,['énergie'],2025-01-11 08:00:00,0.5356
2025-01-11 08:00:00,"« incertitudes », « vents contraires » et « divergences » : la patronne du fmi inquiète pour l'économie mondiale - la tribune","Sat, 11 Jan 2025 08:00:00 GMT","{'href': 'https://www.latribune.fr', 'title': 'La Tribune'}",latribune.fr,tribune,2025-01-08,4,['incertitude'],2025-01-11 08:00:00,-0.9404
2025-01-11 08:00:00,"Crise politique ou crise de régime, la vᵉ république vacille - le monde.fr","Sat, 11 Jan 2025 08:00:00 GMT","{'href': 'https://www.lemonde.fr', 'title': 'Le Monde.fr'}",lemonde.fr,lemonde,2025-01-08,6,['crise'],2025-01-11 08:00:00,-0.903
2025-01-14 08:00:00,Économie : les entreprises du cac 40 ont reversé près de 100 milliards d’euros à leurs actionnaires - franceinfo,"Tue, 14 Jan 2025 08:00:00 GMT","{'href': 'https://www.franceinfo.fr', 'title': 'Franceinfo'}",franceinfo.fr,franceinfo,2025-01-08,4,['cac 40'],2025-01-14 08:00:00,0.4618
2025-01-14 08:00:00,Discours de politique générale : françois bayrou alerte sur la dette et le besoin de stabilité pour tenter de durer - les echos,"Tue, 14 Jan 2025 08:00:00 GMT","{'href': 'https://www.lesechos.fr', 'title': 'Les Echos'}",lesechos.fr,echos,2025-01-08,6,['dette'],2025-01-14 08:00:00,-0.5458
2025-01-14 08:00:00,"Joe biden se félicite de son bilan en politique étrangère, au risque de l’ellipse et du déni - le monde.fr","Tue, 14 Jan 2025 08:00:00 GMT","{'href': 'https://www.lemonde.fr', 'title': 'Le Monde.fr'}",lemonde.fr,lemonde,2025-01-08,4,['risque'],2025-01-14 08:00:00,-0.5269
2025-01-15 08:00:00,"Budget 2025 : 30 milliards d'économies prévus, comment le gouvernement compte s'y prendre - capital.fr","Wed, 15 Jan 2025 08:00:00 GMT","{'href': 'https://www.capital.fr', 'title': 'Capital.fr'}",capital.fr,capital,2025-01-08,10,"['budget', 'gouvernement']",2025-01-15 08:00:00,0.5452
2025-01-15 08:00:00,Allemagne : la première économie d’europe a été en récession pour la deuxième année d’affilée en 2024 - sud ouest,"Wed, 15 Jan 2025 08:00:00 GMT","{'href': 'https://www.sudouest.fr', 'title': 'Sud Ouest'}",sudouest.fr,sudouest,2025-01-08,6,['récession'],2025-01-15 08:00:00,-0.9323
2025-01-15 08:00:00,"Pour la deuxième année d'affilée, l'allemagne est en récession - la tribune","Wed, 15 Jan 2025 08:00:00 GMT","{'href': 'https://www.latribune.fr', 'title': 'La Tribune'}",latribune.fr,tribune,2025-01-08,6,['récession'],2025-01-15 08:00:00,-0.9521
2025-01-15 08:00:00,"Opinion | un code des finances publiques, pour quoi faire ? - les echos","Wed, 15 Jan 2025 08:00:00 GMT","{'href': 'https://www.lesechos.fr', 'title': 'Les Echos'}",lesechos.fr,echos,2025-01-08,8,['finances publiques'],2025-01-15 08:00:00,0.0
2025-01-16 08:00:00,Chine : le rythme de la croissance s'est grippé en 2024 - la tribune,"Thu, 16 Jan 2025 08:00:00 GMT","{'href': 'https://www.latribune.fr', 'title': 'La Tribune'}",latribune.fr,tribune,2025-01-08,4,['croissance'],2025-01-16 08:00:00,-0.7863
2025-01-16 08:00:00,"Le bon, le mauvais et l'incertitude de l'économie de trump - les echos","Thu, 16 Jan 2025 08:00:00 GMT","{'href': 'https://www.lesechos.fr', 'title': 'Les Echos'}",lesechos.fr,echos,2025-01-08,4,['incertitude'],2025-01-16 08:00:00,-0.9369
2025-01-16 08:00:00,Deux prix nobel d'économie contre les milliardaires de la tech américaine - les echos,"Thu, 16 Jan 2025 08:00:00 GMT","{'href': 'https://www.lesechos.fr', 'title': 'Les Echos'}",lesechos.fr,echos,2025-01-08,4,['prix'],2025-01-16 08:00:00,-0.3831
2025-01-19 08:00:00,"Le protectionnisme, une histoire politique des etats-unis, de george washington à donald trump - le monde.fr","Sun, 19 Jan 2025 08:00:00 GMT","{'href': 'https://www.lemonde.fr', 'title': 'Le Monde.fr'}",lemonde.fr,lemonde,2025-01-08,4,['protectionnisme'],2025-01-19 08:00:00,0.0
2025-01-20 08:00:00,Allier performance industrielle et économie circulaire grâce au réemploi des emballages - capital.fr,"Mon, 20 Jan 2025 08:00:00 GMT","{'href': 'https://www.capital.fr', 'title': 'Capital.fr'}",capital.fr,capital,2025-01-08,4,['emploi'],2025-01-20 08:00:00,0.7226
2025-01-20 08:00:00,"Réemploi, économie circulaire : à la découverte de deux entreprises en deux-sèvres - ouest-france","Mon, 20 Jan 2025 08:00:00 GMT","{'href': 'https://www.ouest-france.fr', 'title': 'Ouest-France'}",ouest-france.fr,ouest-france,2025-01-08,4,['emploi'],2025-01-20 08:00:00,0.473
2025-01-21 08:00:00,L'économie mondiale face à la division : trump en vedette virtuelle au forum de davos - les echos,"Tue, 21 Jan 2025 08:00:00 GMT","{'href': 'https://www.lesechos.fr', 'title': 'Les Echos'}",lesechos.fr,echos,2025-01-08,6,['dette'],2025-01-21 08:00:00,-0.6728
2025-01-22 08:00:00,L’éthiopie relance sa bourse et accélère dans la libéralisation de l’économie - le point,"Wed, 22 Jan 2025 08:00:00 GMT","{'href': 'https://www.lepoint.fr', 'title': 'Le Point'}",lepoint.fr,lepoint,2025-01-08,4,['bourse'],2025-01-22 08:00:00,0.7846
2025-01-22 08:00:00,Budget 2025 : le ministre de l’économie exclut une taxation des retraités pour financer la protection sociale - le monde.fr,"Wed, 22 Jan 2025 08:00:00 GMT","{'href': 'https://www.lemonde.fr', 'title': 'Le Monde.fr'}",lemonde.fr,lemonde,2025-01-08,6,['budget'],2025-01-22 08:00:00,0.4483
2025-01-23 08:00:00,L'alerte du nouveau président de la cpme sur la politique de l'offre - les echos,"Thu, 23 Jan 2025 08:00:00 GMT","{'href': 'https://www.lesechos.fr', 'title': 'Les Echos'}",lesechos.fr,echos,2025-01-23,4,['pme'],2025-01-23 08:00:00,-0.843
2025-01-23 08:00:00,"Budget 2025 : le ministre de l'économie, eric lombard, poursuit son opération déminage auprès des socialistes - franceinfo","Thu, 23 Jan 2025 08:00:00 GMT","{'href': 'https://www.franceinfo.fr', 'title': 'Franceinfo'}",franceinfo.fr,franceinfo,2025-01-23,6,['budget'],2025-01-23 08:00:00,0.6325
2025-01-24 08:00:00,"Transition industrielle : ""les gouvernements n'ont manifestement pas les moyens financiers, c'est l'économie et la finance qui vont l'opérer"", selon emmanuel faber - franceinfo","Fri, 24 Jan 2025 08:00:00 GMT","{'href': 'https://www.franceinfo.fr', 'title': 'Franceinfo'}",franceinfo.fr,franceinfo,2025-01-23,4,['gouvernement'],2025-01-24 08:00:00,0.0
2025-01-25 08:00:00,Croissance : «la france est la lanterne rouge de l’économie mondiale !» - capital.fr,"Sat, 25 Jan 2025 08:00:00 GMT","{'href': 'https://www.capital.fr', 'title': 'Capital.fr'}",capital.fr,capital,2025-01-23,4,['croissance'],2025-01-25 08:00:00,0.6813
2025-01-27 08:00:00,« la dynamique est positive » : l’économie sociale crée des emplois - ouest-france,"Mon, 27 Jan 2025 08:00:00 GMT","{'href': 'https://www.ouest-france.fr', 'title': 'Ouest-France'}",ouest-france.fr,ouest-france,2025-01-23,4,['emploi'],2025-01-27 08:00:00,0.8509
2025-01-27 08:00:00,"En belgique, des tensions sociales sur fond de crise politique - le monde.fr","Mon, 27 Jan 2025 08:00:00 GMT","{'href': 'https://www.lemonde.fr', 'title': 'Le Monde.fr'}",lemonde.fr,lemonde,2025-01-23,8,"['crise', 'tension']",2025-01-27 08:00:00,-0.7731
2025-01-27 08:00:00,La mauvaise pente du chômage se confirme en france - les echos,"Mon, 27 Jan 2025 08:00:00 GMT","{'href': 'https://www.lesechos.fr', 'title': 'Les Echos'}",lesechos.fr,echos,2025-01-23,4,['chômage'],2025-01-27 08:00:00,-0.94
2025-01-29 08:00:00,"L'espagne, leader de la croissance en zone euro avec 3,2% en 2024 - la tribune","Wed, 29 Jan 2025 08:00:00 GMT","{'href': 'https://www.latribune.fr', 'title': 'La Tribune'}",latribune.fr,tribune,2025-01-23,4,['croissance'],2025-01-29 08:00:00,0.8171
2025-01-30 08:00:00,"En turquie, les ravages de l’hyperinflation : « pour 200 balles, tu n’as plus rien » - le monde.fr","Thu, 30 Jan 2025 08:00:00 GMT","{'href': 'https://www.lemonde.fr', 'title': 'Le Monde.fr'}",lemonde.fr,lemonde,2025-01-23,10,['inflation'],2025-01-30 08:00:00,-0.8467
2025-01-30 08:00:00,"En france, la croissance française a progressé de 1,1 % en 2024 - le monde.fr","Thu, 30 Jan 2025 08:00:00 GMT","{'href': 'https://www.lemonde.fr', 'title': 'Le Monde.fr'}",lemonde.fr,lemonde,2025-01-23,4,['croissance'],2025-01-30 08:00:00,0.7398
2025-01-30 08:00:00,Croissance : l’économie française plombée par la crise politique et le «contrecoup des jo» - capital.fr,"Thu, 30 Jan 2025 08:00:00 GMT","{'href': 'https://www.capital.fr', 'title': 'Capital.fr'}",capital.fr,capital,2025-01-23,8,"['croissance', 'crise']",2025-01-30 08:00:00,-0.9401
2025-01-30 08:00:00,"La croissance économique française atteint 1,1 % en 2024, malgré une contraction de l’activité en fin d’année - le monde.fr","Thu, 30 Jan 2025 08:00:00 GMT","{'href': 'https://www.lemonde.fr', 'title': 'Le Monde.fr'}",lemonde.fr,lemonde,2025-01-23,4,['croissance'],2025-01-30 08:00:00,0.5461
2025-02-04 08:00:00,"En france, les entreprises tentent de composer avec l’instabilité politique - l'opinion","Tue, 04 Feb 2025 08:00:00 GMT","{'href': 'https://www.lopinion.fr', 'title': ""l'Opinion""}",lopinion.fr,opinion,2025-01-23,6,['instabilité politique'],2025-02-04 08:00:00,-0.7256
2025-02-06 08:00:00,"""la coke fait tenir"" : à l'assemblée nationale, ""le tabou"" de la consommation de drogue - franceinfo","Thu, 06 Feb 2025 08:00:00 GMT","{'href': 'https://www.franceinfo.fr', 'title': 'Franceinfo'}",franceinfo.fr,franceinfo,2025-01-23,4,['assemblée nationale'],2025-02-06 08:00:00,-0.4216
2025-02-06 08:00:00,Les exportations d'électricité n'ont jamais autant rapporté à la france - les echos,"Thu, 06 Feb 2025 08:00:00 GMT","{'href': 'https://www.lesechos.fr', 'title': 'Les Echos'}",lesechos.fr,echos,2025-01-23,8,"['électricité', 'exportations']",2025-02-06 08:00:00,-0.7487
2025-02-06 08:00:00,Le budget 2025 est définitivement adopté au parlement après le vote du sénat ce jeudi - ouest-france,"Thu, 06 Feb 2025 08:00:00 GMT","{'href': 'https://www.ouest-france.fr', 'title': 'Ouest-France'}",ouest-france.fr,ouest-france,2025-01-23,6,['budget'],2025-02-06 08:00:00,0.6259
2025-02-06 08:00:00,Budget 2025 : le gouvernement recule sur la hausse de tva pour les petits entrepreneurs - les echos,"Thu, 06 Feb 2025 08:00:00 GMT","{'href': 'https://www.lesechos.fr', 'title': 'Les Echos'}",lesechos.fr,echos,2025-01-23,10,"['budget', 'gouvernement']",2025-02-06 08:00:00,-0.8824
2025-02-11 08:00:00,"Impôts, économies, santé… ce que contient finalement le budget 2025 - les echos","Tue, 11 Feb 2025 08:00:00 GMT","{'href': 'https://www.lesechos.fr', 'title': 'Les Echos'}",lesechos.fr,echos,2025-02-07,6,['budget'],2025-02-11 08:00:00,0.0
2025-02-12 08:00:00,"Entretien. « certains politiques jouent avec l’économie et l’emploi », dit le président de la cpme - ouest-france","Wed, 12 Feb 2025 08:00:00 GMT","{'href': 'https://www.ouest-france.fr', 'title': 'Ouest-France'}",ouest-france.fr,ouest-france,2025-02-07,8,"['emploi', 'pme']",2025-02-12 08:00:00,0.5373
2025-02-15 08:00:00,"Bfm stratégie (cours n°314) : finance intégrée, une révolution pour les pme - 15/02 - bfm","Sat, 15 Feb 2025 08:00:00 GMT","{'href': 'https://www.bfmtv.com', 'title': 'BFM'}",bfmtv.com,bfm,2025-02-07,4,['pme'],2025-02-15 08:00:00,0.6231
2025-02-18 08:00:00,"En angola, l’etat omniprésent peine à mener les réformes indispensables à la diversification de l’économie - le monde.fr","Tue, 18 Feb 2025 08:00:00 GMT","{'href': 'https://www.lemonde.fr', 'title': 'Le Monde.fr'}",lemonde.fr,lemonde,2025-02-07,4,['réforme'],2025-02-18 08:00:00,0.5593
2025-02-18 08:00:00,"French tech : wavo, la start-up qui finance le stock des tpe-pme - les echos","Tue, 18 Feb 2025 08:00:00 GMT","{'href': 'https://www.lesechos.fr', 'title': 'Les Echos'}",lesechos.fr,echos,2025-02-07,8,"['tpe', 'pme']",2025-02-18 08:00:00,0.5878
2025-02-18 08:00:00,Certificats d'économie d'énergie : un réseau de fraudeurs démantelé en auvergne-rhône-alpes pour un préjudice estimé à 13 millions d'euros - franceinfo,"Tue, 18 Feb 2025 08:00:00 GMT","{'href': 'https://www.franceinfo.fr', 'title': 'Franceinfo'}",franceinfo.fr,franceinfo,2025-02-07,4,['énergie'],2025-02-18 08:00:00,-0.9336
2025-02-19 08:00:00,"Guerre en ukraine : ""c'est un peu contre-intuitif, mais l'économie est en croissance en ukraine"", assure le directeur du crédit agricole à kiev - franceinfo","Wed, 19 Feb 2025 08:00:00 GMT","{'href': 'https://www.franceinfo.fr', 'title': 'Franceinfo'}",franceinfo.fr,franceinfo,2025-02-07,4,['croissance'],2025-02-19 08:00:00,-0.5544
2025-02-19 08:00:00,"Prix de l’économie néo-aquitains : poujoulat, la dynamique d’un fabricant de conduits de cheminée - sud ouest","Wed, 19 Feb 2025 08:00:00 GMT","{'href': 'https://www.sudouest.fr', 'title': 'Sud Ouest'}",sudouest.fr,sudouest,2025-02-07,4,['prix'],2025-02-19 08:00:00,0.0
2025-02-20 08:00:00,Retraites : combien coûterait un retour en arrière sur la réforme de 2023 - les echos,"Thu, 20 Feb 2025 08:00:00 GMT","{'href': 'https://www.lesechos.fr', 'title': 'Les Echos'}",lesechos.fr,echos,2025-02-07,4,['réforme'],2025-02-20 08:00:00,0.0
2025-02-23 08:00:00,Inondations en bretagne : la gestion de crise n’est pas une politique climatique – par sandrine le feur - l'opinion,"Sun, 23 Feb 2025 08:00:00 GMT","{'href': 'https://www.lopinion.fr', 'title': ""l'Opinion""}",lopinion.fr,opinion,2025-02-22,4,['crise'],2025-02-23 08:00:00,-0.8681
2025-02-24 08:00:00,Agenda bourse et économie du 24 au 28 février 2025 - les echos,"Mon, 24 Feb 2025 08:00:00 GMT","{'href': 'https://investir.lesechos.fr', 'title': 'Les Echos'}",investir.lesechos.fr,echos,2025-02-22,4,['bourse'],2025-02-24 08:00:00,0.0
2025-02-24 08:00:00,Nouvelle donne politique en allemagne après les élections législatives - franceinfo,"Mon, 24 Feb 2025 08:00:00 GMT","{'href': 'https://www.franceinfo.fr', 'title': 'Franceinfo'}",franceinfo.fr,franceinfo,2025-02-22,4,['élections'],2025-02-24 08:00:00,0.0
2025-02-26 08:00:00,Croissance : l’économie américaine décevra-t-elle lourdement la bourse ? - capital.fr,"Wed, 26 Feb 2025 08:00:00 GMT","{'href': 'https://www.capital.fr', 'title': 'Capital.fr'}",capital.fr,capital,2025-02-22,8,"['croissance', 'bourse']",2025-02-26 08:00:00,0.0
2025-02-28 08:00:00,S&p adresse à la france un avertissement sans frais - le monde.fr,"Fri, 28 Feb 2025 08:00:00 GMT","{'href': 'https://www.lemonde.fr', 'title': 'Le Monde.fr'}",lemonde.fr,lemonde,2025-02-22,6,['s&p'],2025-02-28 08:00:00,-0.8638
2025-03-03 08:00:00,"Comité d'alerte, audit fiscal… le plan de bercy pour éviter un nouveau dérapage incontrôlé du déficit - les echos","Mon, 03 Mar 2025 08:00:00 GMT","{'href': 'https://www.lesechos.fr', 'title': 'Les Echos'}",lesechos.fr,echos,2025-02-22,8,['déficit'],2025-03-03 08:00:00,-0.8438
2025-03-04 08:00:00,"Franchise de tva : petites entreprises et autoentrepreneurs, que faire d'ici au 1er juin ? - les echos","Tue, 04 Mar 2025 08:00:00 GMT","{'href': 'https://entrepreneurs.lesechos.fr', 'title': 'Les Echos'}",entrepreneurs.lesechos.fr,echos,2025-02-22,4,['petites entreprises'],2025-03-04 08:00:00,0.0
2025-03-04 08:00:00,« la république sous tensions » : enquête sur la crise politique que traverse la france - le monde.fr,"Tue, 04 Mar 2025 08:00:00 GMT","{'href': 'https://www.lemonde.fr', 'title': 'Le Monde.fr'}",lemonde.fr,lemonde,2025-02-22,8,"['crise', 'tension']",2025-03-04 08:00:00,-0.8752
2025-03-04 08:00:00,Loi de finances 2025 – ce qui change pour les entreprises - les echos solutions,"Tue, 04 Mar 2025 08:00:00 GMT","{'href': 'https://solutions.lesechos.fr', 'title': 'Les Echos Solutions'}",solutions.lesechos.fr,echos,2025-02-22,8,['loi de finances'],2025-03-04 08:00:00,0.0
2025-03-04 08:00:00,"Les investissements étrangers en france ont reculé en 2024, sur fond d’instabilité politique et budgétaire - le monde.fr","Tue, 04 Mar 2025 08:00:00 GMT","{'href': 'https://www.lemonde.fr', 'title': 'Le Monde.fr'}",lemonde.fr,lemonde,2025-02-22,10,"['investissement', 'instabilité politique']",2025-03-04 08:00:00,-0.8944
2025-03-05 08:00:00,Siparex et ui investissement s’invitent chez laboratoire polidis - les echos,"Wed, 05 Mar 2025 08:00:00 GMT","{'href': 'https://capitalfinance.lesechos.fr', 'title': 'Les Echos'}",capitalfinance.lesechos.fr,echos,2025-02-22,4,['investissement'],2025-03-05 08:00:00,0.6256
2025-03-06 08:00:00,Chine : hausse de dépenses et réduction de taux d'intérêt pour relancer l'économie - la tribune,"Thu, 06 Mar 2025 08:00:00 GMT","{'href': 'https://www.latribune.fr', 'title': 'La Tribune'}",latribune.fr,tribune,2025-02-22,8,"[""taux d'intérêt""]",2025-03-06 08:00:00,0.7141
2025-03-07 08:00:00,Brésil : lula impopulaire malgré une solide croissance économique - les echos,"Fri, 07 Mar 2025 08:00:00 GMT","{'href': 'https://www.lesechos.fr', 'title': 'Les Echos'}",lesechos.fr,echos,2025-02-22,4,['croissance'],2025-03-07 08:00:00,-0.4221
2025-03-08 08:00:00,Comment se portent vraiment l’économie et l’emploi aux états-unis depuis la réélection de trump ? - ouest-france,"Sat, 08 Mar 2025 08:00:00 GMT","{'href': 'https://www.ouest-france.fr', 'title': 'Ouest-France'}",ouest-france.fr,ouest-france,2025-02-22,4,['emploi'],2025-03-08 08:00:00,-0.6035
2025-03-09 08:00:00,"En roumanie, la crise politique s'intensifie - les echos","Sun, 09 Mar 2025 08:00:00 GMT","{'href': 'https://www.lesechos.fr', 'title': 'Les Echos'}",lesechos.fr,echos,2025-03-09,4,['crise'],2025-03-09 08:00:00,-0.8833
2025-03-09 08:00:00,Économie : quels risques fait encourir donald trump à son pays ? - franceinfo,"Sun, 09 Mar 2025 08:00:00 GMT","{'href': 'https://www.franceinfo.fr', 'title': 'Franceinfo'}",franceinfo.fr,franceinfo,2025-03-09,4,['risque'],2025-03-09 08:00:00,-0.7302
2025-03-09 08:00:00,Prix du livre la tribune : une sélection militante et politique - la tribune,"Sun, 09 Mar 2025 08:00:00 GMT","{'href': 'https://www.latribune.fr', 'title': 'La Tribune'}",latribune.fr,tribune,2025-03-09,4,['prix'],2025-03-09 08:00:00,0.5439
2025-03-10 07:00:00,"Les lourdeurs administratives coûtent-elles 4% du pib de la france chaque année, comme l'affirme françois bayrou - franceinfo","Mon, 10 Mar 2025 07:00:00 GMT","{'href': 'https://www.franceinfo.fr', 'title': 'Franceinfo'}",franceinfo.fr,franceinfo,2025-03-09,6,['pib'],2025-03-10 07:00:00,-0.8681
2025-03-11 07:00:00,Défense : le branle-bas de combat des banques françaises pour financer l'industrie - les echos,"Tue, 11 Mar 2025 07:00:00 GMT","{'href': 'https://www.lesechos.fr', 'title': 'Les Echos'}",lesechos.fr,echos,2025-03-09,4,['banques'],2025-03-11 07:00:00,0.49
2025-03-11 07:00:00,Ce que propose la cpme pour financer l’économie de guerre - le point,"Tue, 11 Mar 2025 07:00:00 GMT","{'href': 'https://www.lepoint.fr', 'title': 'Le Point'}",lepoint.fr,lepoint,2025-03-09,4,['pme'],2025-03-11 07:00:00,0.5074
2025-03-12 07:00:00,"La banque de france abaisse sa prévision de croissance à 0,7 % pour 2025 - le monde.fr","Wed, 12 Mar 2025 07:00:00 GMT","{'href': 'https://www.lemonde.fr', 'title': 'Le Monde.fr'}",lemonde.fr,lemonde,2025-03-09,4,['croissance'],2025-03-12 07:00:00,-0.3723
2025-03-12 07:00:00,"Pour financer l'économie ""de guerre"", pourquoi le gouvernement pourrait privilégier l'assurance-vie - rmc","Wed, 12 Mar 2025 07:00:00 GMT","{'href': 'https://rmc.bfmtv.com', 'title': 'RMC'}",rmc.bfmtv.com,bfm,2025-03-09,4,['gouvernement'],2025-03-12 07:00:00,0.4951
2025-03-12 07:00:00,Bourse : «les craintes sur l'économie américaine pourraient prendre un nouveau tournant» - capital.fr,"Wed, 12 Mar 2025 07:00:00 GMT","{'href': 'https://www.capital.fr', 'title': 'Capital.fr'}",capital.fr,capital,2025-03-09,4,['bourse'],2025-03-12 07:00:00,-0.4555
2025-03-12 07:00:00,"Crise politique au portugal : chute du gouvernement, possibles nouvelles élections, ce qu’il faut savoir - sud ouest","Wed, 12 Mar 2025 07:00:00 GMT","{'href': 'https://www.sudouest.fr', 'title': 'Sud Ouest'}",sudouest.fr,sudouest,2025-03-09,12,"['gouvernement', 'élections', 'crise']",2025-03-12 07:00:00,-0.8662
2025-03-12 07:00:00,Finance verte : l'alliance des banques pour le climat revoit ses objectifs - les echos,"Wed, 12 Mar 2025 07:00:00 GMT","{'href': 'https://www.lesechos.fr', 'title': 'Les Echos'}",lesechos.fr,echos,2025-03-09,4,['banques'],2025-03-12 07:00:00,0.6842
2025-03-14 07:00:00,Dette : la france échappe au couperet de fitch et conserve son « double a » - le monde.fr,"Fri, 14 Mar 2025 07:00:00 GMT","{'href': 'https://www.lemonde.fr', 'title': 'Le Monde.fr'}",lemonde.fr,lemonde,2025-03-09,12,"['dette', 'fitch']",2025-03-14 07:00:00,0.348
2025-03-14 07:00:00,Des traders haute fréquence accusés d'exploiter une faille sur la bourse eurex - les echos,"Fri, 14 Mar 2025 07:00:00 GMT","{'href': 'https://www.lesechos.fr', 'title': 'Les Echos'}",lesechos.fr,echos,2025-03-09,4,['bourse'],2025-03-14 07:00:00,-0.896
