date,title,published,publisher,source,matched_pattern,week,relevance_score,matched_keywords,date.1,sentiment_score
2023-04-13 07:00:00,Comprendre la crise entre taïwan et pékin en six questions - les echos,"Thu, 13 Apr 2023 07:00:00 GMT","{'href': 'https://www.lesechos.fr', 'title': 'Les Echos'}",lesechos.fr,echos,2023-04-04,4,['crise'],2023-04-13 07:00:00,-0.6251
2023-04-14 07:00:00,Qui sont les 9 membres du conseil constitutionnel qui se prononcent sur la réforme des retraites - libération,"Fri, 14 Apr 2023 07:00:00 GMT","{'href': 'https://www.liberation.fr', 'title': 'Libération'}",liberation.fr,liberation,2023-04-04,4,['réforme'],2023-04-14 07:00:00,0.0
2023-04-17 07:00:00,Video - pourquoi l'egypte connaît une crise économique sans précédent - les echos,"Mon, 17 Apr 2023 07:00:00 GMT","{'href': 'https://www.lesechos.fr', 'title': 'Les Echos'}",lesechos.fr,echos,2023-04-04,4,['crise'],2023-04-17 07:00:00,-0.8874
2023-04-17 07:00:00,Mauritius finance forme de futurs professionnels au risque de les perdre - lexpress.mu,"Mon, 17 Apr 2023 07:00:00 GMT","{'href': 'https://lexpress.mu', 'title': 'lexpress.mu'}",lexpress.mu,express,2023-04-04,4,['risque'],2023-04-17 07:00:00,-0.7278
2023-04-19 07:00:00,"Emploi : ce que l'on sait de france travail, la nouvelle entité qui doit remplacer pôle emploi à partir de 2024 - franceinfo","Wed, 19 Apr 2023 07:00:00 GMT","{'href': 'https://www.franceinfo.fr', 'title': 'Franceinfo'}",franceinfo.fr,franceinfo,2023-04-19,6,['emploi'],2023-04-19 07:00:00,0.0
2023-04-20 07:00:00,"La direction de l'economie, de l'emploi et du travail présente son bilan pour 2022 - outre-mer la 1ère","Thu, 20 Apr 2023 07:00:00 GMT","{'href': 'https://la1ere.franceinfo.fr', 'title': 'Outre-mer la 1ère'}",la1ere.franceinfo.fr,franceinfo,2023-04-19,4,['emploi'],2023-04-20 07:00:00,0.0
2023-04-21 07:00:00,"L'économie selon matthieu pigasse : ""la dette, ça n’est pas le sujet, on peut en effacer une partie"" - l'express","Fri, 21 Apr 2023 07:00:00 GMT","{'href': 'https://www.lexpress.fr', 'title': ""L'Express""}",lexpress.fr,express,2023-04-19,6,['dette'],2023-04-21 07:00:00,-0.5186
2023-04-21 07:00:00,Bourse : chatgpt est déjà un as de la finance - les echos,"Fri, 21 Apr 2023 07:00:00 GMT","{'href': 'https://www.lesechos.fr', 'title': 'Les Echos'}",lesechos.fr,echos,2023-04-19,4,['bourse'],2023-04-21 07:00:00,0.0
2023-04-23 07:00:00,"Mayotte, la réforme des retraites, son engagement en politique : retour sur l’entretien d'alexis chaussalet, invité de dimanche politique - outre-mer la 1ère","Sun, 23 Apr 2023 07:00:00 GMT","{'href': 'https://la1ere.franceinfo.fr', 'title': 'Outre-mer la 1ère'}",la1ere.franceinfo.fr,franceinfo,2023-04-19,4,['réforme'],2023-04-23 07:00:00,0.5252
2023-04-27 07:00:00,L’économie ivoirienne poursuit sa dynamique de croissance - le point,"Thu, 27 Apr 2023 07:00:00 GMT","{'href': 'https://www.lepoint.fr', 'title': 'Le Point'}",lepoint.fr,lepoint,2023-04-19,4,['croissance'],2023-04-27 07:00:00,0.7612
2023-04-28 07:00:00,Fitch dégrade la note financière de la france : bruno le maire déplore une « appréciation pessimiste » et soutient la poursuite de « réformes structurantes » - le monde.fr,"Fri, 28 Apr 2023 07:00:00 GMT","{'href': 'https://www.lemonde.fr', 'title': 'Le Monde.fr'}",lemonde.fr,lemonde,2023-04-19,10,"['fitch', 'réforme']",2023-04-28 07:00:00,-0.9134
2023-04-29 07:00:00,« la politique monétaire pour lutter contre l’inflation n’a-t-elle pas plus d’inconvénients que d’avantages ? » - le monde.fr,"Sat, 29 Apr 2023 07:00:00 GMT","{'href': 'https://www.lemonde.fr', 'title': 'Le Monde.fr'}",lemonde.fr,lemonde,2023-04-19,20,"['politique monétaire', 'inflation']",2023-04-29 07:00:00,-0.4418
2023-04-30 07:00:00,"Réforme des retraites, opération wuambushu, union européenne, agriculture, pêche : le député européen lfi younous omarjee était l’invité de dimanche politique - outre-mer la 1ère","Sun, 30 Apr 2023 07:00:00 GMT","{'href': 'https://la1ere.franceinfo.fr', 'title': 'Outre-mer la 1ère'}",la1ere.franceinfo.fr,franceinfo,2023-04-19,4,['réforme'],2023-04-30 07:00:00,-0.7961
2023-05-02 07:00:00,Le forum économique mondial chiffre à 14 millions les pertes nettes d’emplois dans le monde d’ici à 2027 - le monde.fr,"Tue, 02 May 2023 07:00:00 GMT","{'href': 'https://www.lemonde.fr', 'title': 'Le Monde.fr'}",lemonde.fr,lemonde,2023-04-19,4,['emploi'],2023-05-02 07:00:00,-0.7313
2023-05-02 07:00:00,"L’économiste français gabriel zucman reçoit la médaille clark, prestigieux prix d’économie - le monde.fr","Tue, 02 May 2023 07:00:00 GMT","{'href': 'https://www.lemonde.fr', 'title': 'Le Monde.fr'}",lemonde.fr,lemonde,2023-04-19,4,['prix'],2023-05-02 07:00:00,0.8701
2023-05-03 07:00:00,L’économiste français gabriel zucman récompensé par un prestigieux prix aux états-unis - ouest-france,"Wed, 03 May 2023 07:00:00 GMT","{'href': 'https://www.ouest-france.fr', 'title': 'Ouest-France'}",ouest-france.fr,ouest-france,2023-04-19,4,['prix'],2023-05-03 07:00:00,0.8788
2023-05-04 07:00:00,Gérald darmanin provoque une crise avec l’italie en critiquant sa politique migratoire - ouest-france,"Thu, 04 May 2023 07:00:00 GMT","{'href': 'https://www.ouest-france.fr', 'title': 'Ouest-France'}",ouest-france.fr,ouest-france,2023-05-04,4,['crise'],2023-05-04 07:00:00,-0.9395
2023-05-07 07:00:00,"Slovaquie : le banquier ludovit odor désigné premier ministre, après la démission du gouvernement intérimaire - le monde.fr","Sun, 07 May 2023 07:00:00 GMT","{'href': 'https://www.lemonde.fr', 'title': 'Le Monde.fr'}",lemonde.fr,lemonde,2023-05-04,4,['gouvernement'],2023-05-07 07:00:00,-0.7644
2023-05-08 07:00:00,Faut-il continuer de courir après la croissance économique? - le figaro,"Mon, 08 May 2023 07:00:00 GMT","{'href': 'https://www.lefigaro.fr', 'title': 'Le Figaro'}",lefigaro.fr,figaro,2023-05-04,4,['croissance'],2023-05-08 07:00:00,0.0
2023-05-09 07:00:00,Économie au pays basque : la brasserie du pays basque a investi 1 million d’euros pour accompagner sa croissance - sud ouest,"Tue, 09 May 2023 07:00:00 GMT","{'href': 'https://www.sudouest.fr', 'title': 'Sud Ouest'}",sudouest.fr,sudouest,2023-05-04,4,['croissance'],2023-05-09 07:00:00,0.8094
2023-05-09 07:00:00,Jusqu'à 9.000 dollars par mois : les bons salaires des stagiaires aux etats-unis - les echos,"Tue, 09 May 2023 07:00:00 GMT","{'href': 'https://www.lesechos.fr', 'title': 'Les Echos'}",lesechos.fr,echos,2023-05-04,4,['salaires'],2023-05-09 07:00:00,0.0
2023-05-09 07:00:00,"Conseil. en croissance, winside finance veut imposer sa marque - ouest-france","Tue, 09 May 2023 07:00:00 GMT","{'href': 'https://agence-api.ouest-france.fr', 'title': 'Ouest-France'}",agence-api.ouest-france.fr,ouest-france,2023-05-04,4,['croissance'],2023-05-09 07:00:00,0.6101
2023-05-09 07:00:00,Petite embellie sur le front du commerce extérieur de la france - les echos,"Tue, 09 May 2023 07:00:00 GMT","{'href': 'https://www.lesechos.fr', 'title': 'Les Echos'}",lesechos.fr,echos,2023-05-04,4,['commerce extérieur'],2023-05-09 07:00:00,0.6972
2023-05-10 07:00:00,"Pakistan : crise politique et vague de violence autour du sort de l’ancien premier ministre, imran khan - la croix","Wed, 10 May 2023 07:00:00 GMT","{'href': 'https://www.la-croix.com', 'title': 'La Croix'}",la-croix.com,croix,2023-05-04,4,['crise'],2023-05-10 07:00:00,-0.928
2023-05-11 07:00:00,"Critiquée, bnp paribas annonce l’arrêt du financement de nouveaux projets gaziers - ouest-france","Thu, 11 May 2023 07:00:00 GMT","{'href': 'https://www.ouest-france.fr', 'title': 'Ouest-France'}",ouest-france.fr,ouest-france,2023-05-04,4,['gaz'],2023-05-11 07:00:00,-0.8926
2023-05-11 07:00:00,La direction générale des finances publiques : cible privilégiée de la macronie - npa - l’anticapitaliste,"Thu, 11 May 2023 07:00:00 GMT","{'href': 'https://lanticapitaliste.org', 'title': 'NPA - L’Anticapitaliste'}",lanticapitaliste.org,capital,2023-05-04,8,['finances publiques'],2023-05-11 07:00:00,-0.4751
2023-05-12 07:00:00,"En grèce, derrière la reprise économique, la crise sociale perdure - le monde.fr","Fri, 12 May 2023 07:00:00 GMT","{'href': 'https://www.lemonde.fr', 'title': 'Le Monde.fr'}",lemonde.fr,lemonde,2023-05-04,4,['crise'],2023-05-12 07:00:00,-0.8557
2023-05-13 07:00:00,"La france compte-t-elle ""5,1 millions de personnes ayant besoin d'un emploi"", comme l'affirme françois ruffin ? - franceinfo","Sat, 13 May 2023 07:00:00 GMT","{'href': 'https://www.franceinfo.fr', 'title': 'Franceinfo'}",franceinfo.fr,franceinfo,2023-05-04,4,['emploi'],2023-05-13 07:00:00,0.0
2023-05-15 07:00:00,"Choose france : elon musk affirme que « tesla fera des investissements significatifs en france », dans un futur proche - le monde.fr","Mon, 15 May 2023 07:00:00 GMT","{'href': 'https://www.lemonde.fr', 'title': 'Le Monde.fr'}",lemonde.fr,lemonde,2023-05-04,4,['investissement'],2023-05-15 07:00:00,0.6621
2023-05-15 07:00:00,La famille agnelli recrute de grands noms de la finance pour développer sa société d'investissement - les echos,"Mon, 15 May 2023 07:00:00 GMT","{'href': 'https://www.lesechos.fr', 'title': 'Les Echos'}",lesechos.fr,echos,2023-05-04,4,['investissement'],2023-05-15 07:00:00,0.7996
2023-05-17 07:00:00,Japon : la croissance résiste au premier trimestre - les echos,"Wed, 17 May 2023 07:00:00 GMT","{'href': 'https://www.lesechos.fr', 'title': 'Les Echos'}",lesechos.fr,echos,2023-05-04,4,['croissance'],2023-05-17 07:00:00,0.6631
2023-05-19 07:00:00,"Face à la crise climatique, la science économique sommée de se réinventer - le monde.fr","Fri, 19 May 2023 07:00:00 GMT","{'href': 'https://www.lemonde.fr', 'title': 'Le Monde.fr'}",lemonde.fr,lemonde,2023-05-19,4,['crise'],2023-05-19 07:00:00,0.5515
2023-05-19 07:00:00,"Au sénégal, les religieux à l’épreuve de la crise politique - le monde.fr","Fri, 19 May 2023 07:00:00 GMT","{'href': 'https://www.lemonde.fr', 'title': 'Le Monde.fr'}",lemonde.fr,lemonde,2023-05-19,4,['crise'],2023-05-19 07:00:00,-0.7622
2023-05-22 07:00:00,"Julia cagé et vincent pons, prix du meilleur jeune économiste 2023 - le monde.fr","Mon, 22 May 2023 07:00:00 GMT","{'href': 'https://www.lemonde.fr', 'title': 'Le Monde.fr'}",lemonde.fr,lemonde,2023-05-19,4,['prix'],2023-05-22 07:00:00,0.0
2023-05-24 07:00:00,Les experts : la transition verte ne sera pas financée par la dette ou l'impôt selon bruno le maire - 24/05 - bfm,"Wed, 24 May 2023 07:00:00 GMT","{'href': 'https://www.bfmtv.com', 'title': 'BFM'}",bfmtv.com,bfm,2023-05-19,6,['dette'],2023-05-24 07:00:00,0.0
2023-05-24 07:00:00,"« l’économie française résiste bien », affirme la directrice de la fédération française des banques - ouest-france","Wed, 24 May 2023 07:00:00 GMT","{'href': 'https://www.ouest-france.fr', 'title': 'Ouest-France'}",ouest-france.fr,ouest-france,2023-05-19,4,['banques'],2023-05-24 07:00:00,0.7791
2023-05-24 07:00:00,"Inflation. à 18 ans, il crée une appli qui compare les prix et vous aide à faire des économies - ouest-france","Wed, 24 May 2023 07:00:00 GMT","{'href': 'https://www.ouest-france.fr', 'title': 'Ouest-France'}",ouest-france.fr,ouest-france,2023-05-19,14,"['inflation', 'prix']",2023-05-24 07:00:00,0.6276
2023-05-26 07:00:00,Dette : quels pays disposent encore d'un triple a ? - l'express,"Fri, 26 May 2023 07:00:00 GMT","{'href': 'https://www.lexpress.fr', 'title': ""L'Express""}",lexpress.fr,express,2023-05-19,6,['dette'],2023-05-26 07:00:00,0.0
2023-05-30 07:00:00,La silver économie : des opportunités à ne pas manquer dans un marché en pleine croissance - les echos solutions,"Tue, 30 May 2023 07:00:00 GMT","{'href': 'https://solutions.lesechos.fr', 'title': 'Les Echos Solutions'}",solutions.lesechos.fr,echos,2023-05-19,4,['croissance'],2023-05-30 07:00:00,0.8591
2023-05-31 07:00:00,"L’inflation, un piège politique durable pour le gouvernement - le monde.fr","Wed, 31 May 2023 07:00:00 GMT","{'href': 'https://www.lemonde.fr', 'title': 'Le Monde.fr'}",lemonde.fr,lemonde,2023-05-19,14,"['inflation', 'gouvernement']",2023-05-31 07:00:00,-0.9572
2023-06-03 07:00:00,"Politique : robert ménard ""ne dirait pas non"" si on lui proposait d'entrer au gouvernement - france 3 régions","Sat, 03 Jun 2023 07:00:00 GMT","{'href': 'https://france3-regions.franceinfo.fr', 'title': 'France 3 Régions'}",france3-regions.franceinfo.fr,franceinfo,2023-06-03,4,['gouvernement'],2023-06-03 07:00:00,-0.37
2023-06-05 07:00:00,"Le gouvernement s’apprête à enclencher la création de france travail, successeur de pôle emploi - sud ouest","Mon, 05 Jun 2023 07:00:00 GMT","{'href': 'https://www.sudouest.fr', 'title': 'Sud Ouest'}",sudouest.fr,sudouest,2023-06-03,8,"['emploi', 'gouvernement']",2023-06-05 07:00:00,0.5996
2023-06-06 07:00:00,La bulgarie se dote d’un gouvernement pro-occidental après deux ans de crise politique - le monde.fr,"Tue, 06 Jun 2023 07:00:00 GMT","{'href': 'https://www.lemonde.fr', 'title': 'Le Monde.fr'}",lemonde.fr,lemonde,2023-06-03,8,"['gouvernement', 'crise']",2023-06-06 07:00:00,0.4175
2023-06-07 07:00:00,De pôle emploi à france travail : combien coûtera ce changement de logo et d’identité visuelle ? - ouest-france,"Wed, 07 Jun 2023 07:00:00 GMT","{'href': 'https://www.ouest-france.fr', 'title': 'Ouest-France'}",ouest-france.fr,ouest-france,2023-06-03,4,['emploi'],2023-06-07 07:00:00,0.0
2023-06-09 07:00:00,High-tech : les leçons d’une vague historique de suppressions d’emplois - le monde.fr,"Fri, 09 Jun 2023 07:00:00 GMT","{'href': 'https://www.lemonde.fr', 'title': 'Le Monde.fr'}",lemonde.fr,lemonde,2023-06-03,4,['emploi'],2023-06-09 07:00:00,-0.8515
2023-06-09 07:00:00,"Au sénégal, la ville de touba au cœur des négociations dans la crise politique - le monde.fr","Fri, 09 Jun 2023 07:00:00 GMT","{'href': 'https://www.lemonde.fr', 'title': 'Le Monde.fr'}",lemonde.fr,lemonde,2023-06-03,4,['crise'],2023-06-09 07:00:00,0.0
2023-06-12 07:00:00,Bourse : bien choisir ses actions pour générer des revenus - les echos,"Mon, 12 Jun 2023 07:00:00 GMT","{'href': 'https://www.lesechos.fr', 'title': 'Les Echos'}",lesechos.fr,echos,2023-06-03,4,['bourse'],2023-06-12 07:00:00,0.7888
2023-06-13 07:00:00,"Le gouvernement revalorise le prix du biogaz, la filière est soulagée - la tribune","Tue, 13 Jun 2023 07:00:00 GMT","{'href': 'https://www.latribune.fr', 'title': 'La Tribune'}",latribune.fr,tribune,2023-06-03,12,"['prix', 'gaz', 'gouvernement']",2023-06-13 07:00:00,0.5943
2023-06-14 07:00:00,"Au sénégal, l’instabilité politique fait craindre pour la tabaski - le monde.fr","Wed, 14 Jun 2023 07:00:00 GMT","{'href': 'https://www.lemonde.fr', 'title': 'Le Monde.fr'}",lemonde.fr,lemonde,2023-06-03,6,['instabilité politique'],2023-06-14 07:00:00,-0.941
2023-06-18 07:00:00,"En lot-et-garonne, l’économie reste résiliente en 2023, mais il faut être vigilant sur l’inflation - sud ouest","Sun, 18 Jun 2023 07:00:00 GMT","{'href': 'https://www.sudouest.fr', 'title': 'Sud Ouest'}",sudouest.fr,sudouest,2023-06-18,10,['inflation'],2023-06-18 07:00:00,0.4217
2023-06-19 07:00:00,"France: ""au moins 10 milliards d'euros d'économies"" identifiés pour redresser les finances publiques d'ici à 2027 - bfm","Mon, 19 Jun 2023 07:00:00 GMT","{'href': 'https://www.bfmtv.com', 'title': 'BFM'}",bfmtv.com,bfm,2023-06-18,8,['finances publiques'],2023-06-19 07:00:00,0.7313
2023-06-19 07:00:00,Le gouvernement veut faire 10 milliards d’euros d’économies - le monde.fr,"Mon, 19 Jun 2023 07:00:00 GMT","{'href': 'https://www.lemonde.fr', 'title': 'Le Monde.fr'}",lemonde.fr,lemonde,2023-06-18,4,['gouvernement'],2023-06-19 07:00:00,0.586
2023-06-20 07:00:00,Venez poser vos questions au directeur départemental des finances publiques du lot - ladepeche.fr,"Tue, 20 Jun 2023 07:00:00 GMT","{'href': 'https://www.ladepeche.fr', 'title': 'ladepeche.fr'}",ladepeche.fr,ladepeche,2023-06-18,8,['finances publiques'],2023-06-20 07:00:00,0.0
2023-06-20 07:00:00,François villeroy de galhau : « le pic des hausses de salaires devrait être atteint au second semestre en france - les echos,"Tue, 20 Jun 2023 07:00:00 GMT","{'href': 'https://www.lesechos.fr', 'title': 'Les Echos'}",lesechos.fr,echos,2023-06-18,4,['salaires'],2023-06-20 07:00:00,0.4854
2023-06-20 07:00:00,"Michaël delafosse, maire de montpellier : ""la complaisance avec l'islam politique, ça suffit"" - marianne","Tue, 20 Jun 2023 07:00:00 GMT","{'href': 'https://www.marianne.net', 'title': 'Marianne'}",marianne.net,marianne,2023-06-18,4,['tpe'],2023-06-20 07:00:00,0.5666
2023-06-20 07:00:00,"Économie : ""l'extrême pauvreté a été divisée par deux en trente ans"", constate esther duflo, prix nobel d'économie 2019 - franceinfo","Tue, 20 Jun 2023 07:00:00 GMT","{'href': 'https://www.franceinfo.fr', 'title': 'Franceinfo'}",franceinfo.fr,franceinfo,2023-06-18,4,['prix'],2023-06-20 07:00:00,-0.8471
2023-06-21 07:00:00,"Le coût de la réforme ""france travail"" estimé ""entre 300 et 500 millions"" en 2024 - bfm","Wed, 21 Jun 2023 07:00:00 GMT","{'href': 'https://www.bfmtv.com', 'title': 'BFM'}",bfmtv.com,bfm,2023-06-18,4,['réforme'],2023-06-21 07:00:00,0.0
2023-06-22 07:00:00,Vrai ou faux. carburant : vaut-il mieux faire son plein d'essence le matin pour faire des économies - ladepeche.fr,"Thu, 22 Jun 2023 07:00:00 GMT","{'href': 'https://www.ladepeche.fr', 'title': 'ladepeche.fr'}",ladepeche.fr,ladepeche,2023-06-18,6,"['carburant', 'essence']",2023-06-22 07:00:00,0.0
2023-06-23 07:00:00,« l’economie politique » explore un au-delà de la croissance - le monde.fr,"Fri, 23 Jun 2023 07:00:00 GMT","{'href': 'https://www.lemonde.fr', 'title': 'Le Monde.fr'}",lemonde.fr,lemonde,2023-06-18,4,['croissance'],2023-06-23 07:00:00,0.0
2023-06-27 07:00:00,Financement des entreprises : quelle stratégie adopter dans un contexte de crise ? - les echos solutions,"Tue, 27 Jun 2023 07:00:00 GMT","{'href': 'https://solutions.lesechos.fr', 'title': 'Les Echos Solutions'}",solutions.lesechos.fr,echos,2023-06-18,4,['crise'],2023-06-27 07:00:00,0.0
2023-06-27 07:00:00,Le sénégal s'enlise dans la crise politique - les echos,"Tue, 27 Jun 2023 07:00:00 GMT","{'href': 'https://www.lesechos.fr', 'title': 'Les Echos'}",lesechos.fr,echos,2023-06-18,4,['crise'],2023-06-27 07:00:00,-0.8862
2023-06-29 07:00:00,"C'est quoi l'institut avant-garde, ce think tank qui veut parler dette et financement de la transition écologique - les echos","Thu, 29 Jun 2023 07:00:00 GMT","{'href': 'https://www.lesechos.fr', 'title': 'Les Echos'}",lesechos.fr,echos,2023-06-18,6,['dette'],2023-06-29 07:00:00,0.0
2023-06-29 07:00:00,"Économie : à rodez, le marché de l’automobile de luxe accélère plein gaz - ladepeche.fr","Thu, 29 Jun 2023 07:00:00 GMT","{'href': 'https://www.ladepeche.fr', 'title': 'ladepeche.fr'}",ladepeche.fr,ladepeche,2023-06-18,4,['gaz'],2023-06-29 07:00:00,0.5306
2023-07-01 07:00:00,"“l’inflation reflue, le spectre de la déflation menace notre économie” - capital.fr","Sat, 01 Jul 2023 07:00:00 GMT","{'href': 'https://www.capital.fr', 'title': 'Capital.fr'}",capital.fr,capital,2023-06-18,10,['inflation'],2023-07-01 07:00:00,-0.9567
2023-07-04 07:00:00,Quartiers prioritaires : les jeunes et les peu diplômés marqués par le chômage - centre d'observation de la société,"Tue, 04 Jul 2023 07:00:00 GMT","{'href': 'https://www.observationsociete.fr', 'title': ""Centre d'observation de la société""}",observationsociete.fr,obs,2023-07-03,4,['chômage'],2023-07-04 07:00:00,-0.4327
2023-07-05 07:00:00,Combien pèse l’agriculture dans le pib des pays européens ? - 20 minutes,"Wed, 05 Jul 2023 07:00:00 GMT","{'href': 'https://www.20minutes.fr', 'title': '20 Minutes'}",20minutes.fr,20minutes,2023-07-03,6,['pib'],2023-07-05 07:00:00,0.0
2023-07-12 07:00:00,Epargne : vers une réforme du pel pour financer la rénovation thermique - les echos,"Wed, 12 Jul 2023 07:00:00 GMT","{'href': 'https://www.lesechos.fr', 'title': 'Les Echos'}",lesechos.fr,echos,2023-07-03,4,['réforme'],2023-07-12 07:00:00,0.6997
2023-07-18 07:00:00,Pluralisme sur cnews : pourquoi la presse écrite n’est-elle pas soumise aux mêmes obligations que l’audiovisuel - libération,"Tue, 18 Jul 2023 07:00:00 GMT","{'href': 'https://www.liberation.fr', 'title': 'Libération'}",liberation.fr,liberation,2023-07-18,8,['obligations'],2023-07-18 07:00:00,-0.8681
2023-07-19 07:00:00,Philippe dauba pantanacce (standard chartered) : «l'europe semble promise à une croissance molle - l'opinion,"Wed, 19 Jul 2023 07:00:00 GMT","{'href': 'https://www.lopinion.fr', 'title': ""l'Opinion""}",lopinion.fr,opinion,2023-07-18,4,['croissance'],2023-07-19 07:00:00,0.6889
2023-07-20 07:00:00,Remaniement : pourquoi les ministres issus de la société civile ont-ils disparu du gouvernement ? - ouest-france,"Thu, 20 Jul 2023 07:00:00 GMT","{'href': 'https://www.ouest-france.fr', 'title': 'Ouest-France'}",ouest-france.fr,ouest-france,2023-07-18,4,['gouvernement'],2023-07-20 07:00:00,-0.8935
2023-07-20 07:00:00,Remaniement : comment marlène schiappa est passée d'étoile montante de la macronie à persona non grata évincée du gouvernement - ladepeche.fr,"Thu, 20 Jul 2023 07:00:00 GMT","{'href': 'https://www.ladepeche.fr', 'title': 'ladepeche.fr'}",ladepeche.fr,ladepeche,2023-07-18,4,['gouvernement'],2023-07-20 07:00:00,-0.7482
2023-07-21 07:00:00,Remaniement : huit arrivées pour un nouveau gouvernement borne au profil plus politique - le monde.fr,"Fri, 21 Jul 2023 07:00:00 GMT","{'href': 'https://www.lemonde.fr', 'title': 'Le Monde.fr'}",lemonde.fr,lemonde,2023-07-18,4,['gouvernement'],2023-07-21 07:00:00,0.5358
2023-07-22 07:00:00,Comment certaines compagnies aériennes parviennent-elles à proposer des prix si attractifs ? - ouest-france,"Sat, 22 Jul 2023 07:00:00 GMT","{'href': 'https://www.ouest-france.fr', 'title': 'Ouest-France'}",ouest-france.fr,ouest-france,2023-07-18,4,['prix'],2023-07-22 07:00:00,0.4328
2023-07-24 07:00:00,La dynastie rothschild fait ses adieux à la bourse - les echos,"Mon, 24 Jul 2023 07:00:00 GMT","{'href': 'https://www.lesechos.fr', 'title': 'Les Echos'}",lesechos.fr,echos,2023-07-18,4,['bourse'],2023-07-24 07:00:00,-0.9304
2023-07-27 07:00:00,"Etats-unis : l'investissement des entreprises, très subventionné, porte la croissance - les echos","Thu, 27 Jul 2023 07:00:00 GMT","{'href': 'https://www.lesechos.fr', 'title': 'Les Echos'}",lesechos.fr,echos,2023-07-18,8,"['croissance', 'investissement']",2023-07-27 07:00:00,0.8317
2023-07-27 07:00:00,Économie : easy cash fait livrer 31 smartphones de seconde main au nouveau gouvernement - sud ouest,"Thu, 27 Jul 2023 07:00:00 GMT","{'href': 'https://www.sudouest.fr', 'title': 'Sud Ouest'}",sudouest.fr,sudouest,2023-07-18,4,['gouvernement'],2023-07-27 07:00:00,0.6128
2023-07-28 07:00:00,"Face à la pression des ong, axa prêt à ne plus assurer de nouveaux projets gaziers - la tribune","Fri, 28 Jul 2023 07:00:00 GMT","{'href': 'https://www.latribune.fr', 'title': 'La Tribune'}",latribune.fr,tribune,2023-07-18,4,['gaz'],2023-07-28 07:00:00,-0.8079
2023-07-28 07:00:00,L'inflation poursuit son reflux en france - les echos,"Fri, 28 Jul 2023 07:00:00 GMT","{'href': 'https://www.lesechos.fr', 'title': 'Les Echos'}",lesechos.fr,echos,2023-07-18,10,['inflation'],2023-07-28 07:00:00,-0.9271
2023-07-28 07:00:00,La croissance française a rebondi nettement plus qu'attendu au deuxième trimestre - les echos,"Fri, 28 Jul 2023 07:00:00 GMT","{'href': 'https://www.lesechos.fr', 'title': 'Les Echos'}",lesechos.fr,echos,2023-07-18,4,['croissance'],2023-07-28 07:00:00,0.6685
2023-07-31 07:00:00,Le nouveau défi d’elon musk: réveiller les industriels de l'électricité - l'opinion,"Mon, 31 Jul 2023 07:00:00 GMT","{'href': 'https://www.lopinion.fr', 'title': ""l'Opinion""}",lopinion.fr,opinion,2023-07-18,4,['électricité'],2023-07-31 07:00:00,0.5193
2023-08-02 07:00:00,Pourquoi l’embellie du commerce extérieur de la france est à relativiser - ouest-france,"Wed, 02 Aug 2023 07:00:00 GMT","{'href': 'https://www.ouest-france.fr', 'title': 'Ouest-France'}",ouest-france.fr,ouest-france,2023-08-02,4,['commerce extérieur'],2023-08-02 07:00:00,-0.8028
2023-08-02 07:00:00,"""pourquoi la france est-elle si riche ?"" : la presse étrangère s’étonne de notre croissance - l'express","Wed, 02 Aug 2023 07:00:00 GMT","{'href': 'https://www.lexpress.fr', 'title': ""L'Express""}",lexpress.fr,express,2023-08-02,4,['croissance'],2023-08-02 07:00:00,0.7317
2023-08-02 07:00:00,Tabac et alcool : le coût pour les finances publiques excède largement les recettes fiscales - la tribune,"Wed, 02 Aug 2023 07:00:00 GMT","{'href': 'https://www.latribune.fr', 'title': 'La Tribune'}",latribune.fr,tribune,2023-08-02,8,['finances publiques'],2023-08-02 07:00:00,-0.444
2023-08-02 07:00:00,Interview lionel perey (responsable sécurité opérationnelle bnp paribas) : « il faut s'exercer à la crise au moins une fois par an » - le monde informatique,"Wed, 02 Aug 2023 07:00:00 GMT","{'href': 'https://www.lemondeinformatique.fr', 'title': 'Le Monde Informatique'}",lemondeinformatique.fr,lemonde,2023-08-02,4,['crise'],2023-08-02 07:00:00,-0.5167
2023-08-02 07:00:00,"« les changements de note n'ont aucun impact sur la dette des grandes économies » (sylvain bersinger, économiste) - la tribune","Wed, 02 Aug 2023 07:00:00 GMT","{'href': 'https://www.latribune.fr', 'title': 'La Tribune'}",latribune.fr,tribune,2023-08-02,6,['dette'],2023-08-02 07:00:00,-0.4891
2023-08-04 07:00:00,La croissance de l'emploi privé marque le pas en france - les echos,"Fri, 04 Aug 2023 07:00:00 GMT","{'href': 'https://www.lesechos.fr', 'title': 'Les Echos'}",lesechos.fr,echos,2023-08-02,8,"['croissance', 'emploi']",2023-08-04 07:00:00,0.8771
