date,title,published,publisher,source,matched_pattern,week,relevance_score,matched_keywords,date.1,sentiment_score
2021-11-02 07:00:00,"En géorgie, la crise politique s’aggrave après des élections locales contestées - le monde.fr","Tue, 02 Nov 2021 07:00:00 GMT","{'href': 'https://www.lemonde.fr', 'title': 'Le Monde.fr'}",lemonde.fr,lemonde,2021-10-26,8,"['élections', 'crise']",2021-11-02 07:00:00,-0.9123
2021-11-02 07:00:00,"Prix économique en lot-et-garonne : le groupe sacpa, acteur majeur du contrôle animal - sud ouest","Tue, 02 Nov 2021 07:00:00 GMT","{'href': 'https://www.sudouest.fr', 'title': 'Sud Ouest'}",sudouest.fr,sudouest,2021-10-26,4,['prix'],2021-11-02 07:00:00,0.6361
2021-11-03 07:00:00,Trois pays de l'est confrontés à une double crise politique et sanitaire - les echos,"Wed, 03 Nov 2021 07:00:00 GMT","{'href': 'https://www.lesechos.fr', 'title': 'Les Echos'}",lesechos.fr,echos,2021-11-03,4,['crise'],2021-11-03 07:00:00,-0.9037
2021-11-03 07:00:00,Prix de l’économie en lot-et-garonne : dumona en terreaux connus - sud ouest,"Wed, 03 Nov 2021 07:00:00 GMT","{'href': 'https://www.sudouest.fr', 'title': 'Sud Ouest'}",sudouest.fr,sudouest,2021-11-03,4,['prix'],2021-11-03 07:00:00,0.0
2021-11-03 07:00:00,La crise du covid n'a pas aggravé la pauvreté en france - les echos,"Wed, 03 Nov 2021 07:00:00 GMT","{'href': 'https://www.lesechos.fr', 'title': 'Les Echos'}",lesechos.fr,echos,2021-11-03,4,['crise'],2021-11-03 07:00:00,-0.7969
2021-11-04 07:00:00,"Le cac 40 n’a jamais été aussi élevé, jusqu’où peut-il grimper ? - ouest-france","Thu, 04 Nov 2021 07:00:00 GMT","{'href': 'https://www.ouest-france.fr', 'title': 'Ouest-France'}",ouest-france.fr,ouest-france,2021-11-03,4,['cac 40'],2021-11-04 07:00:00,-0.5917
2021-11-04 07:00:00,Bourse de paris. quelles sont les raisons de l’emballement du cac 40 ? - ouest-france,"Thu, 04 Nov 2021 07:00:00 GMT","{'href': 'https://www.ouest-france.fr', 'title': 'Ouest-France'}",ouest-france.fr,ouest-france,2021-11-03,8,"['bourse', 'cac 40']",2021-11-04 07:00:00,0.0
2021-11-04 07:00:00,"Avec un pouvoir d'achat de 20.662 euros par habitant, la france se classe au 15e rang européen - bfm","Thu, 04 Nov 2021 07:00:00 GMT","{'href': 'https://www.bfmtv.com', 'title': 'BFM'}",bfmtv.com,bfm,2021-11-03,4,"[""pouvoir d'achat""]",2021-11-04 07:00:00,0.6878
2021-11-05 07:00:00,"Prix de l’économie en lot-et-garonne : boosté par la crise sanitaire, cash piscines surfe sur la bonne vague - sud ouest","Fri, 05 Nov 2021 07:00:00 GMT","{'href': 'https://www.sudouest.fr', 'title': 'Sud Ouest'}",sudouest.fr,sudouest,2021-11-03,8,"['prix', 'crise']",2021-11-05 07:00:00,-0.408
2021-11-08 08:00:00,"Face à la hausse des prix, l'économie de la guadeloupe se met en berne - outre-mer la 1ère","Mon, 08 Nov 2021 08:00:00 GMT","{'href': 'https://la1ere.franceinfo.fr', 'title': 'Outre-mer la 1ère'}",la1ere.franceinfo.fr,franceinfo,2021-11-03,10,"['hausse des prix', 'prix']",2021-11-08 08:00:00,0.3628
2021-11-09 08:00:00,Le manque de travailleurs étrangers qualifiés pénalise la croissance en france - les echos,"Tue, 09 Nov 2021 08:00:00 GMT","{'href': 'https://www.lesechos.fr', 'title': 'Les Echos'}",lesechos.fr,echos,2021-11-03,4,['croissance'],2021-11-09 08:00:00,-0.9037
2021-11-09 08:00:00,Prix de l’économie en lot-et-garonne : cataldi voit la crise covid comme une opportunité - sud ouest,"Tue, 09 Nov 2021 08:00:00 GMT","{'href': 'https://www.sudouest.fr', 'title': 'Sud Ouest'}",sudouest.fr,sudouest,2021-11-03,8,"['prix', 'crise']",2021-11-09 08:00:00,0.6026
2021-11-09 08:00:00,Économie en lot-et-garonne : le prix de la croissance décerné à cataldi - sud ouest,"Tue, 09 Nov 2021 08:00:00 GMT","{'href': 'https://www.sudouest.fr', 'title': 'Sud Ouest'}",sudouest.fr,sudouest,2021-11-03,8,"['prix', 'croissance']",2021-11-09 08:00:00,0.0
2021-11-09 08:00:00,La france restitue solennellement 26 trésors pillés au bénin - le monde.fr,"Tue, 09 Nov 2021 08:00:00 GMT","{'href': 'https://www.lemonde.fr', 'title': 'Le Monde.fr'}",lemonde.fr,lemonde,2021-11-03,6,['trésor'],2021-11-09 08:00:00,0.7219
2021-11-10 08:00:00,"«le miracle économique polonais». la tribune d’adam glapiński, président de la banque centrale polonaise - l'opinion","Wed, 10 Nov 2021 08:00:00 GMT","{'href': 'https://www.lopinion.fr', 'title': ""l'Opinion""}",lopinion.fr,opinion,2021-11-03,6,['banque centrale'],2021-11-10 08:00:00,0.4904
2021-11-11 08:00:00,"A dakar, une journée politique sous haute tension - le monde.fr","Thu, 11 Nov 2021 08:00:00 GMT","{'href': 'https://www.lemonde.fr', 'title': 'Le Monde.fr'}",lemonde.fr,lemonde,2021-11-11,4,['tension'],2021-11-11 08:00:00,-0.8416
2021-11-12 08:00:00,"Sophie ho tong (finance conseil): volumes de transactions, prix, taux... comment le marché immobilier évolue-t-il ? - 12/11 - bfm","Fri, 12 Nov 2021 08:00:00 GMT","{'href': 'https://www.bfmtv.com', 'title': 'BFM'}",bfmtv.com,bfm,2021-11-11,4,['prix'],2021-11-12 08:00:00,0.0
2021-11-12 08:00:00,L’europe est-elle si dépendante du gaz russe ? cinq questions après les menaces de la biélorussie - ouest-france,"Fri, 12 Nov 2021 08:00:00 GMT","{'href': 'https://www.ouest-france.fr', 'title': 'Ouest-France'}",ouest-france.fr,ouest-france,2021-11-11,4,['gaz'],2021-11-12 08:00:00,-0.924
2021-11-15 08:00:00,"Essence, baguette, voiture… ces produits coûtent-ils plus cher aujourd’hui qu’en 1970 ? - ouest-france","Mon, 15 Nov 2021 08:00:00 GMT","{'href': 'https://www.ouest-france.fr', 'title': 'Ouest-France'}",ouest-france.fr,ouest-france,2021-11-11,2,['essence'],2021-11-15 08:00:00,0.0
2021-11-16 08:00:00,Néo-aquitains en dordogne : les prix des entreprises qui vont de l’avant - sud ouest,"Tue, 16 Nov 2021 08:00:00 GMT","{'href': 'https://www.sudouest.fr', 'title': 'Sud Ouest'}",sudouest.fr,sudouest,2021-11-11,4,['prix'],2021-11-16 08:00:00,0.0
2021-11-16 08:00:00,Banque : la résurrection à haut risque du ccf - les echos,"Tue, 16 Nov 2021 08:00:00 GMT","{'href': 'https://www.lesechos.fr', 'title': 'Les Echos'}",lesechos.fr,echos,2021-11-11,4,['risque'],2021-11-16 08:00:00,-0.5198
2021-11-17 08:00:00,Prix de l’économie néo-aquitains 2021 en dordogne : découvrez le palmarès - sud ouest,"Wed, 17 Nov 2021 08:00:00 GMT","{'href': 'https://www.sudouest.fr', 'title': 'Sud Ouest'}",sudouest.fr,sudouest,2021-11-11,4,['prix'],2021-11-17 08:00:00,0.0
2021-11-17 08:00:00,"Irak : à bassora, les crises climatique et politique empoisonnent la population - mediapart","Wed, 17 Nov 2021 08:00:00 GMT","{'href': 'https://www.mediapart.fr', 'title': 'Mediapart'}",mediapart.fr,mediapart,2021-11-11,4,['crise'],2021-11-17 08:00:00,-0.9481
2021-11-17 08:00:00,« l’énergie de yannick jadot est deux fois moins chère que l’énergie d’emmanuel macron » - le monde.fr,"Wed, 17 Nov 2021 08:00:00 GMT","{'href': 'https://www.lemonde.fr', 'title': 'Le Monde.fr'}",lemonde.fr,lemonde,2021-11-11,6,['énergie'],2021-11-17 08:00:00,0.0
2021-11-17 08:00:00,"Orelsan dévoile l'odeur de l'essence , le premier extrait très politique de son nouvel album - le figaro","Wed, 17 Nov 2021 08:00:00 GMT","{'href': 'https://www.lefigaro.fr', 'title': 'Le Figaro'}",lefigaro.fr,figaro,2021-11-11,2,['essence'],2021-11-17 08:00:00,0.5041
2021-11-17 08:00:00,"La dordogne qui exporte : le caviar prunier, un géant toujours en croissance - sud ouest","Wed, 17 Nov 2021 08:00:00 GMT","{'href': 'https://www.sudouest.fr', 'title': 'Sud Ouest'}",sudouest.fr,sudouest,2021-11-11,4,['croissance'],2021-11-17 08:00:00,0.9379
2021-11-17 08:00:00,Orelsan dévoile le clip très politique de «l’odeur de l’essence» - le parisien,"Wed, 17 Nov 2021 08:00:00 GMT","{'href': 'https://www.leparisien.fr', 'title': 'Le Parisien'}",leparisien.fr,parisien,2021-11-11,2,['essence'],2021-11-17 08:00:00,-0.5143
2021-11-17 08:00:00,"Orelsan dévoile ""l'odeur de l'essence"", un titre politique explosif qui dézingue des leaders pyromanes - franceinfo","Wed, 17 Nov 2021 08:00:00 GMT","{'href': 'https://www.franceinfo.fr', 'title': 'Franceinfo'}",franceinfo.fr,franceinfo,2021-11-11,2,['essence'],2021-11-17 08:00:00,-0.8176
2021-11-18 08:00:00,"Pour le troisième anniversaire des gilets jaunes, orelsan dévoile «l'odeur de l'essence», brûlot politique - l'opinion","Thu, 18 Nov 2021 08:00:00 GMT","{'href': 'https://www.lopinion.fr', 'title': ""l'Opinion""}",lopinion.fr,opinion,2021-11-11,2,['essence'],2021-11-18 08:00:00,-0.4672
2021-11-18 08:00:00,"Politique. françois goulard devient le trésorier d’horizons, le parti d’édouard philippe - ouest-france","Thu, 18 Nov 2021 08:00:00 GMT","{'href': 'https://www.ouest-france.fr', 'title': 'Ouest-France'}",ouest-france.fr,ouest-france,2021-11-11,6,['trésor'],2021-11-18 08:00:00,-0.3947
2021-11-18 08:00:00,"Croissance de la france : l’ocde relève sa prévision à 6,8 % en 2021 et 4,2 % en 2022 - le monde.fr","Thu, 18 Nov 2021 08:00:00 GMT","{'href': 'https://www.lemonde.fr', 'title': 'Le Monde.fr'}",lemonde.fr,lemonde,2021-11-11,4,['croissance'],2021-11-18 08:00:00,0.0
2021-11-19 08:00:00,Clarida (fed) s'oppose à une politique coordonnée des banques centrales - les echos,"Fri, 19 Nov 2021 08:00:00 GMT","{'href': 'https://investir.lesechos.fr', 'title': 'Les Echos'}",investir.lesechos.fr,echos,2021-11-19,4,['banques'],2021-11-19 08:00:00,0.5126
2021-11-22 08:00:00,"Crise en guadeloupe : première tempête politique pour le ministre des outre-mer, sébastien lecornu - le parisien","Mon, 22 Nov 2021 08:00:00 GMT","{'href': 'https://www.leparisien.fr', 'title': 'Le Parisien'}",leparisien.fr,parisien,2021-11-19,4,['crise'],2021-11-22 08:00:00,-0.9269
2021-11-22 08:00:00,Les maths font les frais de la réforme du bac - les echos,"Mon, 22 Nov 2021 08:00:00 GMT","{'href': 'https://www.lesechos.fr', 'title': 'Les Echos'}",lesechos.fr,echos,2021-11-19,4,['réforme'],2021-11-22 08:00:00,0.0
2021-11-24 08:00:00,Trophées de l’économie. crédit mutuel : « il faut une énergie folle pour lancer son entreprise » - ouest-france,"Wed, 24 Nov 2021 08:00:00 GMT","{'href': 'https://www.ouest-france.fr', 'title': 'Ouest-France'}",ouest-france.fr,ouest-france,2021-11-19,4,['énergie'],2021-11-24 08:00:00,0.4247
2021-11-24 08:00:00,Landes : qui sont les cinq lauréats des prix de l’économie néo-aquitains en 2021 ? - sud ouest,"Wed, 24 Nov 2021 08:00:00 GMT","{'href': 'https://www.sudouest.fr', 'title': 'Sud Ouest'}",sudouest.fr,sudouest,2021-11-19,4,['prix'],2021-11-24 08:00:00,0.0
2021-11-26 08:00:00,Pourquoi les banques centrales doivent se démocratiser - les echos,"Fri, 26 Nov 2021 08:00:00 GMT","{'href': 'https://www.lesechos.fr', 'title': 'Les Echos'}",lesechos.fr,echos,2021-11-19,4,['banques'],2021-11-26 08:00:00,-0.7935
2021-11-26 08:00:00,Maîtriser la production d’énergie grâce à la société d’économie mixte elo - ladepeche.fr,"Fri, 26 Nov 2021 08:00:00 GMT","{'href': 'https://www.ladepeche.fr', 'title': 'ladepeche.fr'}",ladepeche.fr,ladepeche,2021-11-19,4,['énergie'],2021-11-26 08:00:00,0.6501
2021-11-29 08:00:00,Jean-pierre raffarin : « la cohésion sociale est une priorité qu'il faut financer malgré la dette - les echos,"Mon, 29 Nov 2021 08:00:00 GMT","{'href': 'https://www.lesechos.fr', 'title': 'Les Echos'}",lesechos.fr,echos,2021-11-27,6,['dette'],2021-11-29 08:00:00,0.702
2021-11-29 08:00:00,"Coupe de france: groupes, qualifiés… le mode d’emploi du tirage pour les 32es de finale - rmc sport","Mon, 29 Nov 2021 08:00:00 GMT","{'href': 'https://rmcsport.bfmtv.com', 'title': 'RMC Sport'}",rmcsport.bfmtv.com,bfm,2021-11-27,4,['emploi'],2021-11-29 08:00:00,0.0
2021-11-29 08:00:00,Gironde : découvrez les lauréats des prix de l’économie néo-aquitains 2021 - sud ouest,"Mon, 29 Nov 2021 08:00:00 GMT","{'href': 'https://www.sudouest.fr', 'title': 'Sud Ouest'}",sudouest.fr,sudouest,2021-11-27,4,['prix'],2021-11-29 08:00:00,0.0
2021-11-29 08:00:00,"« l’effort des industriels doit porter sur l’investissement » (jean-luc chauvin, président cci amp) - la tribune","Mon, 29 Nov 2021 08:00:00 GMT","{'href': 'https://www.latribune.fr', 'title': 'La Tribune'}",latribune.fr,tribune,2021-11-27,4,['investissement'],2021-11-29 08:00:00,0.0
2021-11-30 08:00:00,Gironde : les prix de l’économie néo-aquitains célèbrent le succès des entreprises qui parient sur l’avenir - sud ouest,"Tue, 30 Nov 2021 08:00:00 GMT","{'href': 'https://www.sudouest.fr', 'title': 'Sud Ouest'}",sudouest.fr,sudouest,2021-11-27,4,['prix'],2021-11-30 08:00:00,0.9026
2021-12-01 08:00:00,"Arctic lng-2 : malgré total, la france interdit à ses banques de soutenir la giga-usine de gaz pilotée par la russie - la tribune","Wed, 01 Dec 2021 08:00:00 GMT","{'href': 'https://www.latribune.fr', 'title': 'La Tribune'}",latribune.fr,tribune,2021-11-27,8,"['gaz', 'banques']",2021-12-01 08:00:00,-0.9353
2021-12-02 08:00:00,Capital finance vous invite à sa conférence financement pme-eti le 8 décembre - les echos,"Thu, 02 Dec 2021 08:00:00 GMT","{'href': 'https://capitalfinance.lesechos.fr', 'title': 'Les Echos'}",capitalfinance.lesechos.fr,echos,2021-11-27,4,['pme'],2021-12-02 08:00:00,0.0
2021-12-06 08:00:00,Présidentielle : valérie pécresse promet un régime sec budgétaire… et des hausses de salaires - les echos,"Mon, 06 Dec 2021 08:00:00 GMT","{'href': 'https://www.lesechos.fr', 'title': 'Les Echos'}",lesechos.fr,echos,2021-12-05,4,['salaires'],2021-12-06 08:00:00,0.6515
2021-12-06 08:00:00,Bri : les banques centrales prônent une supervision mondiale des gestionnaires d'actifs - les echos,"Mon, 06 Dec 2021 08:00:00 GMT","{'href': 'https://www.lesechos.fr', 'title': 'Les Echos'}",lesechos.fr,echos,2021-12-05,4,['banques'],2021-12-06 08:00:00,0.6554
2021-12-07 08:00:00,Le grand prix de l’humour politique 2021 décerné à marlène schiappa - le point,"Tue, 07 Dec 2021 08:00:00 GMT","{'href': 'https://www.lepoint.fr', 'title': 'Le Point'}",lepoint.fr,lepoint,2021-12-05,4,['prix'],2021-12-07 08:00:00,0.5635
2021-12-08 08:00:00,Pyrénées-atlantiques : qui sont les lauréats des prix de l’économie néo-aquitains 2021 ? - sud ouest,"Wed, 08 Dec 2021 08:00:00 GMT","{'href': 'https://www.sudouest.fr', 'title': 'Sud Ouest'}",sudouest.fr,sudouest,2021-12-05,4,['prix'],2021-12-08 08:00:00,0.0
2021-12-08 08:00:00,Finance : le classement des banques préférées des marocains - lopinion.ma,"Wed, 08 Dec 2021 08:00:00 GMT","{'href': 'https://lopinion.ma', 'title': 'lopinion.ma'}",lopinion.ma,opinion,2021-12-05,4,['banques'],2021-12-08 08:00:00,0.0
2021-12-08 08:00:00,"« on ne va pas s’interdire les plans à trois » : marlène schiappa, grand prix de l’humour politique - ouest-france","Wed, 08 Dec 2021 08:00:00 GMT","{'href': 'https://www.ouest-france.fr', 'title': 'Ouest-France'}",ouest-france.fr,ouest-france,2021-12-05,4,['prix'],2021-12-08 08:00:00,0.3879
2021-12-08 08:00:00,"""on ne va pas interdire les plans à trois"": avec cette formule, marlène schiappa remporte le grand prix de l'humour politique 2021 - franceinfo","Wed, 08 Dec 2021 08:00:00 GMT","{'href': 'https://www.franceinfo.fr', 'title': 'Franceinfo'}",franceinfo.fr,franceinfo,2021-12-05,4,['prix'],2021-12-08 08:00:00,0.7165
2021-12-08 08:00:00,"S'il vous plaît, parlez-nous de croissance ! par alain madelin - l'express","Wed, 08 Dec 2021 08:00:00 GMT","{'href': 'https://www.lexpress.fr', 'title': ""L'Express""}",lexpress.fr,express,2021-12-05,4,['croissance'],2021-12-08 08:00:00,0.4899
2021-12-10 08:00:00,"Malgré la crise politique, la bosnie ne veut pas croire au retour de la guerre - le monde.fr","Fri, 10 Dec 2021 08:00:00 GMT","{'href': 'https://www.lemonde.fr', 'title': 'Le Monde.fr'}",lemonde.fr,lemonde,2021-12-05,4,['crise'],2021-12-10 08:00:00,-0.8536
2021-12-13 08:00:00,Bulgarie : un gouvernement anti-corruption se met en place après huit mois de crise - les echos,"Mon, 13 Dec 2021 08:00:00 GMT","{'href': 'https://www.lesechos.fr', 'title': 'Les Echos'}",lesechos.fr,echos,2021-12-13,8,"['gouvernement', 'crise']",2021-12-13 08:00:00,-0.3818
2021-12-15 08:00:00,Crise du covid : la france a-t-elle été plus généreuse que les autres pays européens pour protéger les ménages - capital.fr,"Wed, 15 Dec 2021 08:00:00 GMT","{'href': 'https://www.capital.fr', 'title': 'Capital.fr'}",capital.fr,capital,2021-12-13,4,['crise'],2021-12-15 08:00:00,-0.5675
2021-12-16 08:00:00,La bce mettra fin au programme d'urgence face à la pandémie après mars - bfm,"Thu, 16 Dec 2021 08:00:00 GMT","{'href': 'https://mediaplayer.bfmtv.com', 'title': 'BFM'}",mediaplayer.bfmtv.com,bfm,2021-12-13,10,['bce'],2021-12-16 08:00:00,-0.661
2021-12-16 08:00:00,"Jean-pierre farandou, pdg de la sncf, au sujet de la grève, pour une hausse des salaires : « on ne peut pas être hypergénéreux en ce moment » - le monde.fr","Thu, 16 Dec 2021 08:00:00 GMT","{'href': 'https://www.lemonde.fr', 'title': 'Le Monde.fr'}",lemonde.fr,lemonde,2021-12-13,4,['salaires'],2021-12-16 08:00:00,0.388
2021-12-17 08:00:00,Pétrole - environnement : « il y a une urgence économique en afrique » - la tribune,"Fri, 17 Dec 2021 08:00:00 GMT","{'href': 'https://www.latribune.fr', 'title': 'La Tribune'}",latribune.fr,tribune,2021-12-13,4,['pétrole'],2021-12-17 08:00:00,-0.7998
2021-12-22 08:00:00,"La croissance de l'économie américaine au troisième trimestre révisée en légère hausse, à 2,3% - challenges tn","Wed, 22 Dec 2021 08:00:00 GMT","{'href': 'https://www.challenges.tn', 'title': 'Challenges TN'}",challenges.tn,challenges,2021-12-21,4,['croissance'],2021-12-22 08:00:00,0.6825
2021-12-23 08:00:00,"Extrême droite : «la furia», nouveau magazine pour regarder les choses en faf - libération","Thu, 23 Dec 2021 08:00:00 GMT","{'href': 'https://www.liberation.fr', 'title': 'Libération'}",liberation.fr,liberation,2021-12-21,4,['gaz'],2021-12-23 08:00:00,0.0
2021-12-25 08:00:00,L’euro fête ses 20 ans. la monnaie unique a-t-elle vraiment fait flamber les prix ? - ouest-france,"Sat, 25 Dec 2021 08:00:00 GMT","{'href': 'https://www.ouest-france.fr', 'title': 'Ouest-France'}",ouest-france.fr,ouest-france,2021-12-21,4,['prix'],2021-12-25 08:00:00,-0.6743
2021-12-27 08:00:00,"Après des tensions extrêmes, les matières premières tardent à revenir à la normale - les echos","Mon, 27 Dec 2021 08:00:00 GMT","{'href': 'https://www.lesechos.fr', 'title': 'Les Echos'}",lesechos.fr,echos,2021-12-21,4,['tension'],2021-12-27 08:00:00,-0.8711
2021-12-28 08:00:00,Le chômage baisse en france : comment sont classés les demandeurs d’emploi - sud ouest,"Tue, 28 Dec 2021 08:00:00 GMT","{'href': 'https://www.sudouest.fr', 'title': 'Sud Ouest'}",sudouest.fr,sudouest,2021-12-21,8,"['chômage', 'emploi']",2021-12-28 08:00:00,-0.6167
2021-12-28 08:00:00,Le conseil constitutionnel retoque des «chevaux de troie» planqués dans la loi de finances 2022 - le parisien,"Tue, 28 Dec 2021 08:00:00 GMT","{'href': 'https://www.leparisien.fr', 'title': 'Le Parisien'}",leparisien.fr,parisien,2021-12-21,8,['loi de finances'],2021-12-28 08:00:00,-0.4869
2021-12-29 08:00:00,Crise politique en somalie : la tension monte à mogadiscio - le monde.fr,"Wed, 29 Dec 2021 08:00:00 GMT","{'href': 'https://www.lemonde.fr', 'title': 'Le Monde.fr'}",lemonde.fr,lemonde,2021-12-29,8,"['crise', 'tension']",2021-12-29 08:00:00,-0.867
2021-12-31 08:00:00,"L’euro, 20 ans et toujours en pleine crise d'adolescence - le point","Fri, 31 Dec 2021 08:00:00 GMT","{'href': 'https://www.lepoint.fr', 'title': 'Le Point'}",lepoint.fr,lepoint,2021-12-29,4,['crise'],2021-12-31 08:00:00,-0.9199
2021-12-31 08:00:00,"Carnet – jérôme fourquet et jean-laurent cassely, prix du livre d’économie 2021 - le point","Fri, 31 Dec 2021 08:00:00 GMT","{'href': 'https://www.lepoint.fr', 'title': 'Le Point'}",lepoint.fr,lepoint,2021-12-29,4,['prix'],2021-12-31 08:00:00,0.0
2022-01-03 08:00:00,Turquie : 5 minutes pour comprendre la folle inflation - le parisien,"Mon, 03 Jan 2022 08:00:00 GMT","{'href': 'https://www.leparisien.fr', 'title': 'Le Parisien'}",leparisien.fr,parisien,2021-12-29,10,['inflation'],2022-01-03 08:00:00,-0.5333
2022-01-03 08:00:00,"Économie en lot-et-garonne : pour faire face à la flambée du gaz, tellus ceram réduit sa capacité de cuisson - sud ouest","Mon, 03 Jan 2022 08:00:00 GMT","{'href': 'https://www.sudouest.fr', 'title': 'Sud Ouest'}",sudouest.fr,sudouest,2021-12-29,4,['gaz'],2022-01-03 08:00:00,-0.4493
2022-01-04 08:00:00,"Croissance, déficit : les chiffres de 2021 seront meilleurs que prévu, selon le gouvernement - les echos","Tue, 04 Jan 2022 08:00:00 GMT","{'href': 'https://www.lesechos.fr', 'title': 'Les Echos'}",lesechos.fr,echos,2021-12-29,16,"['déficit', 'croissance', 'gouvernement']",2022-01-04 08:00:00,0.591
2022-01-05 08:00:00,«la france a six mois pour refonder l’europe… ou pas» – la tribune de jean-christophe lagarde et james chéron - l'opinion,"Wed, 05 Jan 2022 08:00:00 GMT","{'href': 'https://www.lopinion.fr', 'title': ""l'Opinion""}",lopinion.fr,opinion,2021-12-29,6,['lagarde'],2022-01-05 08:00:00,-0.4844
2022-01-05 08:00:00,"Razika adnani : ""il faut réformer l’islam pour le dissocier de sa dimension politique"" - marianne","Wed, 05 Jan 2022 08:00:00 GMT","{'href': 'https://www.marianne.net', 'title': 'Marianne'}",marianne.net,marianne,2021-12-29,4,['réforme'],2022-01-05 08:00:00,-0.4919
2022-01-07 08:00:00,«cette idée que c’est la fin de la france est exagérée»: le dernier entretien de philippe de gaulle au figaro magazine - le figaro,"Fri, 07 Jan 2022 08:00:00 GMT","{'href': 'https://www.lefigaro.fr', 'title': 'Le Figaro'}",lefigaro.fr,figaro,2022-01-06,4,['gaz'],2022-01-07 08:00:00,-0.906
2022-01-07 08:00:00,Le groupe bgfibank : relais des banques et entreprises actives avec le continent africain - le figaro,"Fri, 07 Jan 2022 08:00:00 GMT","{'href': 'https://www.lefigaro.fr', 'title': 'Le Figaro'}",lefigaro.fr,figaro,2022-01-06,4,['banques'],2022-01-07 08:00:00,0.0
2022-01-09 08:00:00,Inflation : les gagnants… et les perdants ! - capital.fr,"Sun, 09 Jan 2022 08:00:00 GMT","{'href': 'https://www.capital.fr', 'title': 'Capital.fr'}",capital.fr,capital,2022-01-06,10,['inflation'],2022-01-09 08:00:00,-0.6389
2022-01-11 08:00:00,Prix de l’économie néo aquitains : qui sont les finalistes ? - sud ouest,"Tue, 11 Jan 2022 08:00:00 GMT","{'href': 'https://www.sudouest.fr', 'title': 'Sud Ouest'}",sudouest.fr,sudouest,2022-01-06,4,['prix'],2022-01-11 08:00:00,0.0
2022-01-13 08:00:00,Prix de l’excellence économique : trois lycéens décrochent un prix régional - sud ouest,"Thu, 13 Jan 2022 08:00:00 GMT","{'href': 'https://www.sudouest.fr', 'title': 'Sud Ouest'}",sudouest.fr,sudouest,2022-01-06,6,['prix'],2022-01-13 08:00:00,0.7977
2022-01-14 08:00:00,"Edf va racheter son électricité jusqu'à 300 euros le mwh… et la revendre à 46,20 euros à ses concurrents - marianne","Fri, 14 Jan 2022 08:00:00 GMT","{'href': 'https://www.marianne.net', 'title': 'Marianne'}",marianne.net,marianne,2022-01-14,4,['électricité'],2022-01-14 08:00:00,0.0
2022-01-16 08:00:00,Brest. « les chefs d’entreprise ont besoin de boussoles et de radars en cette période de crise » - ouest-france,"Sun, 16 Jan 2022 08:00:00 GMT","{'href': 'https://www.ouest-france.fr', 'title': 'Ouest-France'}",ouest-france.fr,ouest-france,2022-01-14,4,['crise'],2022-01-16 08:00:00,-0.598
2022-01-16 08:00:00,"Energie, transport, pétrochimie… les défis du « zéro pétrole » - le monde.fr","Sun, 16 Jan 2022 08:00:00 GMT","{'href': 'https://www.lemonde.fr', 'title': 'Le Monde.fr'}",lemonde.fr,lemonde,2022-01-14,4,['pétrole'],2022-01-16 08:00:00,0.0
2022-01-16 08:00:00,"Loire-atlantique. malgré la crise, le projet « nouveau france » continue - ouest-france","Sun, 16 Jan 2022 08:00:00 GMT","{'href': 'https://www.ouest-france.fr', 'title': 'Ouest-France'}",ouest-france.fr,ouest-france,2022-01-14,4,['crise'],2022-01-16 08:00:00,0.3892
2022-01-17 08:00:00,"Covid-19 : la fortune des milliardaires a plus augmenté pendant la crise qu’au cours de la dernière décennie, selon oxfam - le monde.fr","Mon, 17 Jan 2022 08:00:00 GMT","{'href': 'https://www.lemonde.fr', 'title': 'Le Monde.fr'}",lemonde.fr,lemonde,2022-01-14,4,['crise'],2022-01-17 08:00:00,0.0
2022-01-18 08:00:00,Bernard attali livre un mode d’emploi pour une économie du long terme - challenges,"Tue, 18 Jan 2022 08:00:00 GMT","{'href': 'https://www.challenges.fr', 'title': 'Challenges'}",challenges.fr,challenges,2022-01-14,4,['emploi'],2022-01-18 08:00:00,0.0
2022-01-18 08:00:00,Irdi fait appel à un directeur d'investissement - les echos,"Tue, 18 Jan 2022 08:00:00 GMT","{'href': 'https://capitalfinance.lesechos.fr', 'title': 'Les Echos'}",capitalfinance.lesechos.fr,echos,2022-01-14,4,['investissement'],2022-01-18 08:00:00,0.0
2022-01-19 08:00:00,Politique : jean-michel blanquer risque-t-il ses fonctions ? - franceinfo,"Wed, 19 Jan 2022 08:00:00 GMT","{'href': 'https://www.franceinfo.fr', 'title': 'Franceinfo'}",franceinfo.fr,franceinfo,2022-01-14,4,['risque'],2022-01-19 08:00:00,0.0
2022-01-19 08:00:00,Covid-19 : le coût exorbitant de 3 ans de crise pour les finances publiques - le point,"Wed, 19 Jan 2022 08:00:00 GMT","{'href': 'https://www.lepoint.fr', 'title': 'Le Point'}",lepoint.fr,lepoint,2022-01-14,12,"['finances publiques', 'crise']",2022-01-19 08:00:00,-0.9007
2022-01-21 08:00:00,Le contournement ouest de montpellier sera gratuit et financé à 100% par vinci autoroutes - france 3 régions,"Fri, 21 Jan 2022 08:00:00 GMT","{'href': 'https://france3-regions.franceinfo.fr', 'title': 'France 3 Régions'}",france3-regions.franceinfo.fr,franceinfo,2022-01-14,4,['tpe'],2022-01-21 08:00:00,0.0
2022-01-21 08:00:00,"Dette, croissance, inflation... ces indicateurs macroéconomiques qui commencent à inquiéter - le parisien","Fri, 21 Jan 2022 08:00:00 GMT","{'href': 'https://www.leparisien.fr', 'title': 'Le Parisien'}",leparisien.fr,parisien,2022-01-14,20,"['inflation', 'dette', 'croissance']",2022-01-21 08:00:00,-0.9126
